Focus Group,Pain Point,processed_pain_points,label,vader_sentiment
DOCE CommercialPermitElectrical Inspectors,Difficulty Managing Inspection Histories: Inspectors must manually review large volumes of information.,difficulty managing inspection history inspector must manually review large volume information,negative,negative
DOCE CommercialPermitElectrical Inspectors,Searching for Information: Important project and permit information can be difficult to locate.,searching information important project permit information difficult locate,negative,negative
DOCE CommercialPermitElectrical Inspectors,No Unified Permit Record: Information is spread across multiple systems.,unified permit record information spread across multiple system,positive,positive
DOCE CommercialPermitElectrical Inspectors,Project Visibility Issues: Inspectors lack visibility into all project activities from one location.,project visibility issue inspector lack visibility project activity one location,negative,negative
DOCE CommercialPermitElectrical Inspectors,Scheduling Disconnect: Inspections scheduled in Camino do not automatically appear in Outlook.,scheduling disconnect inspection scheduled camino automatically appear outlook,neutral,neutral
DOCE CommercialPermitElectrical Inspectors,No Calendar Integration: Inspectors maintain duplicate schedules.,calendar integration inspector maintain duplicate schedule,neutral,negative
DOCE CommercialPermitElectrical Inspectors,No Tickler Functionality: Camino lacks reminder and follow-up tracking capabilities.,tickler functionality camino lack reminder tracking capability,negative,negative
DOCE CommercialPermitElectrical Inspectors,Address Management Issues: Address information can be inaccurate or difficult to manage.,address management issue address information inaccurate difficult manage,negative,negative
DOCE CommercialPermitElectrical Inspectors,Duplicate Records: Duplicate entries exist within Camino.,duplicate record duplicate entry exist within camino,neutral,neutral
DOCE CommercialPermitElectrical Inspectors,Navigation Difficulties: Users find Camino difficult to navigate.,navigation difficulty user find camino difficult navigate,negative,negative
DOCE CommercialPermitElectrical Inspectors,Limited Visibility: Difficult to see assigned work and active projects.,limited visibility difficult see assigned work active project,negative,negative
DOCE CommercialPermitElectrical Inspectors,No Internal Reminder System: Inspectors rely on manual notes and tracking methods.,internal reminder system inspector rely manual note tracking method,neutral,negative
DOCE CommercialPermitElectrical Inspectors,Internet Dependency: Some functions are unavailable when connectivity issues occur.,internet dependency function unavailable connectivity issue occur,neutral,neutral
DOCE CommercialPermitElectrical Inspectors,Permit Office Coordination Issues: Permit processes are not fully integrated.,permit office coordination issue permit process fully integrated,neutral,neutral
DOCE CommercialPermitElectrical Inspectors,Contractor Coordination: Contractors do not always respond promptly to communication.,contractor coordination contractor always respond promptly communication,neutral,neutral
DOCE CommercialPermitElectrical Inspectors,Lack of Coordination: Electrical inspectors identified limited coordination across teams.,lack coordination electrical inspector identified limited coordination across team,negative,negative
DOCE CommercialPermitElectrical Inspectors,Training Gaps: Insufficient training on Camino and related processes.,training gap insufficient training camino related process,neutral,neutral
DOCE CommercialPermitElectrical Inspectors,Manual Follow-Up Requirements: Inspectors must manually track contractor responses and inspection needs.,manual requirement inspector must manually track contractor response inspection need,neutral,neutral
DOCE CommercialPermitElectrical Inspectors,Handwritten Tracking: Inspectors often maintain handwritten schedules and inspection notes.,handwritten tracking inspector often maintain handwritten schedule inspection note,neutral,neutral
DOCE CommercialPermitElectrical Inspectors,Duplicate Data Entry: Information must be entered and tracked in multiple locations.,duplicate data entry information must entered tracked multiple location,neutral,neutral
DOCE CommercialPermitElectrical Inspectors,Limited Mobile Functionality: Field-based work remains partially paper-driven.,limited mobile functionality work remains partially,negative,negative
DOCE Fire Prevention Bureau,"Historical Research Takes Too Long: Researching prior violations, occupancy records, and property history requires multiple searches and system access.",historical research take long researching prior violation occupancy record property history requires multiple search system access,negative,negative
DOCE Fire Prevention Bureau,Difficult Certificate Research: Finding previous Certificates of Occupancy and capacity information requires extensive digging.,difficult certificate research finding previous certificate occupancy capacity information requires extensive digging,negative,negative
DOCE Fire Prevention Bureau,Multiple Search Locations: Information exists in several areas of the system.,multiple search location information exists several area system,neutral,neutral
DOCE Fire Prevention Bureau,Parcel Search Limitations: Parcel information must be exact and is difficult to locate.,parcel search limitation parcel information must exact difficult locate,negative,negative
DOCE Fire Prevention Bureau,"Multiple Documentation Locations: Users document actions, inspections, photos, and violations in different places.",multiple documentation location user document action inspection photo violation different place,negative,negative
DOCE Fire Prevention Bureau,Inconsistent Documentation Practices: Different users store information differently.,inconsistent documentation practice different user store information differently,neutral,neutral
DOCE Fire Prevention Bureau,Missing Parcel Information: Important parcel data is unavailable or difficult to locate.,missing parcel information important parcel data unavailable difficult locate,negative,negative
DOCE Fire Prevention Bureau,Inactive Parcel Issues: Parcels that are active appear inactive within IPS.,inactive parcel issue parcel active appear inactive within ip,positive,positive
DOCE Fire Prevention Bureau,Certificate & Inspection Review Challenges,certificate inspection review challenge,positive,positive
DOCE Fire Prevention Bureau,CofO Sign-Off Process: Reviewing Certificates of Occupancy requires checking multiple locations.,cofo process reviewing certificate occupancy requires checking multiple location,neutral,neutral
DOCE Fire Prevention Bureau,Closed Inspection Visibility: Difficult to locate all completed inspections associated with a project.,closed inspection visibility difficult locate completed inspection associated project,negative,negative
DOCE Fire Prevention Bureau,Review Tracking Challenges: Tracking inspection and permit review status is cumbersome.,review tracking challenge tracking inspection permit review status cumbersome,positive,positive
DOCE Fire Prevention Bureau,Desktop Dependency: IPS does not function well outside the office.,desktop dependency ip function well outside office,positive,negative
DOCE Fire Prevention Bureau,No Effective Mobile Access: Inspectors cannot effectively use IPS in the field.,effective mobile access inspector effectively use ip field,positive,negative
DOCE Fire Prevention Bureau,Limited Real-Time Documentation: Inspection information is not easily entered from mobile devices.,limited documentation inspection information easily entered mobile device,positive,negative
DOCE Fire Prevention Bureau,No Built-In Calendar: Camino and EPR lack effective scheduling and calendar functionality.,calendar camino epr lack effective scheduling calendar functionality,positive,negative
DOCE Fire Prevention Bureau,"Multiple Scheduling Systems: Staff use Outlook, ERP, and permit systems (Camino) simultaneously.",multiple scheduling system staff use outlook erp permit system camino simultaneously,neutral,neutral
DOCE Fire Prevention Bureau,Duplicate Scheduling Activities: Inspection scheduling must be maintained in multiple locations.,duplicate scheduling activity inspection scheduling must maintained multiple location,neutral,neutral
DOCE Fire Prevention Bureau,"Too Many Systems: Staff use IPS, Camino, EPR, Compliance Engine, Outlook, spreadsheets, and paper planners.",many system staff use ip camino epr compliance engine outlook spreadsheet paper planner,neutral,neutral
DOCE Fire Prevention Bureau,Weak Integration: Information does not move efficiently between systems.,weak integration information move efficiently system,negative,negative
DOCE Fire Prevention Bureau,Manual Coordination: Significant effort is required to coordinate data across platforms.,manual coordination significant effort required coordinate data across platform,positive,positive
DOCE Fire Prevention Bureau,"Large Volume of Documentation: Managing plans, inspections, corrections, and approvals is time-consuming.",large volume documentation managing plan inspection correction approval,positive,neutral
DOCE Fire Prevention Bureau,Permit Review Tracking: Monitoring project reviews requires manual follow-up.,permit review tracking monitoring project review requires manual,neutral,neutral
DOCE Fire Prevention Bureau,Property Identification Issues: Properties with multiple businesses or occupancies are difficult to manage.,property identification issue property multiple business occupancy difficult manage,negative,negative
DOCE Fire Prevention Bureau,Address Matching Challenges: Searches require exact addresses.,address matching challenge search require exact address,positive,positive
DOCE Housing Inspectors,System Freezing: IPS frequently freezes or experiences loading delays.,system freezing ip frequently freeze experience loading delay,negative,negative
DOCE Housing Inspectors,Slow Performance: Opening cases and completing actions can be slow.,slow performance opening case completing action slow,neutral,neutral
DOCE Housing Inspectors,System Shutdowns: IPS occasionally requires restarts or intervention to function properly.,system shutdown ip occasionally requires restarts intervention function properly,neutral,neutral
DOCE Housing Inspectors,Remote Access Issues: Difficulties connecting to IPS remotely from the field.,remote access issue difficulty connecting ip remotely field,negative,negative
DOCE Housing Inspectors,No Global Case View: Difficult to review all active and closed cases associated with a property.,global case view difficult review active closed case associated property,positive,negative
DOCE Housing Inspectors,Case Navigation Complexity: Navigating cases requires extensive system knowledge and experience.,case navigation complexity navigating case requires extensive system knowledge experience,neutral,neutral
DOCE Housing Inspectors,Too Many Actions: Large numbers of actions and dropdown options create inefficiencies.,many action large number action dropdown option create inefficiency,positive,positive
DOCE Housing Inspectors,"No Case Categorization: Cases cannot easily be categorized by status such as drive-by inspections, waiting on owners, or follow-up activities.",case categorization case easily categorized status inspection waiting owner activity,positive,negative
DOCE Housing Inspectors,No Automated Case Monitoring: Difficult to identify cases lacking inspection dates or pending reviews.,automated case monitoring difficult identify case lacking inspection date pending review,negative,negative
DOCE Housing Inspectors,Ownership Information Issues: Ownership information is not always updated consistently.,ownership information issue ownership information always updated consistently,neutral,neutral
DOCE Housing Inspectors,Address Management Problems: Address changes do not automatically update across all cases.,address management problem address change automatically update across case,negative,negative
DOCE Housing Inspectors,No Unified Address Book: Property and ownership information can vary between systems.,unified address book property ownership information vary system,positive,positive
DOCE Housing Inspectors,Lead Map Accessibility: Lead-risk information is not readily available within cases.,lead map accessibility information readily available within case,neutral,neutral
DOCE Housing Inspectors,Limited Water Information Access: Water records are not available directly in IPS.,limited water information access water record available directly ip,negative,negative
DOCE Housing Inspectors,Information Fragmentation: Important information exists in multiple systems and locations.,information fragmentation important information exists multiple system location,positive,positive
DOCE Housing Inspectors,Limited Field Access: Inspectors cannot fully access or update IPS while in the field.,limited field access inspector fully access update ip field,negative,negative
DOCE Housing Inspectors,Photo Upload Process: Uploading and organizing photos is cumbersome.,photo upload process uploading organizing photo cumbersome,neutral,neutral
DOCE Housing Inspectors,No Mobile Workflow: Inspectors must often return to the office to complete documentation.,mobile workflow inspector must often return office complete documentation,neutral,negative
DOCE Housing Inspectors,No Laptop Access: Limited ability to update cases during inspections.,laptop access limited ability update case inspection,positive,negative
DOCE Housing Inspectors,"Too Many Systems: Inspectors must use IPS, AS400, GIS, Outlook, Dropbox, spreadsheets, lead maps, and external databases.",many system inspector must use ip gi outlook dropbox spreadsheet lead map external database,neutral,neutral
DOCE Housing Inspectors,"Repeated Research: Ownership, water, and lead information require separate searches.",repeated research ownership water lead information require separate search,neutral,neutral
DOCE Housing Inspectors,No Single Source of Truth: Property information is spread across multiple applications.,single source truth property information spread across multiple application,positive,neutral
DOCE Housing Inspectors,Shared Data Issues: Information entered by multiple users can create delays or confusion.,shared data issue information entered multiple user create delay confusion,neutral,positive
DOCE Housing Inspectors,Address Updates: Address corrections are not consistently communicated throughout systems.,address update address correction consistently communicated throughout system,neutral,neutral
DOCE Housing Inspectors,Manual Tracking: Inspectors maintain spreadsheets and notes to manage workloads.,manual tracking inspector maintain spreadsheet note manage workload,neutral,neutral
DOCE Housing Inspectors,Lead Map Verification: Frequent manual checking of lead maps.,lead map verification frequent manual checking lead map,neutral,neutral
DOCE Housing Inspectors,Violation Entry Delays: Simultaneous data entry can slow violation processing.,violation entry delay simultaneous data entry slow violation processing,negative,negative
DOCE Housing Inspectors,Large Dropdown Lists: Long dropdown menus make data entry inefficient.,large dropdown list long dropdown menu make data entry inefficient,neutral,neutral
DOCE Housing Inspectors,Case Organization Difficulties: Difficult to distinguish between different case types and statuses.,case organization difficulty difficult distinguish different case type status,negative,negative
DOCE Office Manager,Duplicate ownership and contact records.,duplicate ownership contact record,neutral,neutral
DOCE Office Manager,Ownership updates do not consistently propagate across records.,ownership update consistently propagate across record,neutral,neutral
DOCE Office Manager,"Difficult to track relationships between owners, agents, and businesses.",difficult track relationship owner agent business,negative,negative
DOCE Office Manager,Property manager information is difficult to maintain.,property manager information difficult maintain,negative,negative
DOCE Office Manager,Address updates require extensive manual effort.,address update require extensive manual effort,neutral,neutral
DOCE Office Manager,Mailing and parcel addresses are managed separately.,mailing parcel address managed separately,neutral,neutral
DOCE Office Manager,Changes often require updates in multiple locations.,change often require update multiple location,neutral,neutral
DOCE Office Manager,Difficult to locate ownership and historical property information.,difficult locate ownership historical property information,negative,negative
DOCE Office Manager,Parcel History can be difficult to navigate.,parcel history difficult navigate,negative,negative
DOCE Office Manager,Historical records are not easily accessible.,historical record easily accessible,positive,negative
DOCE Office Manager,Searching across properties and cases is inefficient.,searching across property case inefficient,neutral,neutral
DOCE Office Manager,Frequent crashes and memory-related errors.,frequent crash error,negative,negative
DOCE Office Manager,Unexpected shutdowns can result in lost work.,unexpected shutdown result lost work,negative,negative
DOCE Office Manager,Performance decreases when handling multiple records.,performance decrease handling multiple record,neutral,neutral
DOCE Office Manager,BAA referrals require significant manual oversight.,baa referral require significant manual oversight,positive,positive
DOCE Office Manager,Document management and uploads can be inconsistent.,document management uploads inconsistent,neutral,neutral
DOCE Office Manager,Administrative workflows are not standardized across modules.,administrative workflow standardized across module,neutral,neutral
DOCE Office Manager,Duplicate data entry is common.,duplicate data entry common,neutral,neutral
DOCE Office Manager,No centralized source of property and ownership information exists.,centralized source property ownership information exists,neutral,negative
DOCE Office Manager,Tickets are frequently returned for minor corrections.,ticket frequently returned minor correction,neutral,neutral
DOCE Office Manager,Multiple review cycles delay enforcement activities.,multiple review cycle delay enforcement activity,negative,negative
DOCE Office Manager,"Significant coordination is required between Office Managers, inspectors, and BAA.",significant coordination required office manager inspector baa,positive,positive
DOCE Office Manager,Ownership verification requires multiple systems.,ownership verification requires multiple system,neutral,neutral
DOCE Office Manager,Historical property information can be difficult to locate.,historical property information difficult locate,negative,negative
DOCE Office Manager,Tracking ownership changes requires extensive manual research.,tracking ownership change requires extensive manual research,neutral,neutral
DOCE Office Manager,High volumes of records management and research activities.,high volume record management research activity,neutral,neutral
DOCE Office Manager,Significant time spent correcting data and ownership issues.,significant time spent correcting data ownership issue,positive,positive
DOCE Office Manager,Executive support and special projects compete with operational responsibilities.,executive support special project compete operational responsibility,positive,positive
DOCE Office Managers,IPS crashes frequently during complaint entry and daily operations.,ip crash frequently complaint entry daily operation,negative,negative
DOCE Office Managers,Users experience unhandled exceptions and memory-related errors.,user experience unhandled exception error,negative,negative
DOCE Office Managers,Work can be lost when the system crashes unexpectedly.,work lost system crash unexpectedly,negative,negative
DOCE Office Managers,Multiple open tabs may contribute to instability.,multiple open tab may contribute instability,neutral,neutral
DOCE Office Managers,Inspection appointments must be entered into multiple systems.,inspection appointment must entered multiple system,neutral,neutral
DOCE Office Managers,Outlook and IPS schedules are not synchronized.,outlook ip schedule synchronized,neutral,neutral
DOCE Office Managers,Periodic Inspection scheduling workflows are cumbersome.,periodic inspection scheduling workflow cumbersome,neutral,neutral
DOCE Office Managers,Inspector lists in the Periodic Inspection module are not alphabetized.,inspector list periodic inspection module alphabetized,neutral,neutral
DOCE Office Managers,Finding specific cases can be difficult.,finding specific case difficult,negative,negative
DOCE Office Managers,Parcel History provides limited information when reviewing large properties.,parcel history provides limited information reviewing large property,negative,negative
DOCE Office Managers,Important information can be difficult to locate within cases.,important information difficult locate within case,negative,negative
DOCE Office Managers,Case notes and attachments are not always organized consistently.,case note attachment always organized consistently,positive,positive
DOCE Office Managers,Some features behave differently across modules.,feature behave differently across module,neutral,neutral
DOCE Office Managers,Certain attachments cannot always be uploaded successfully.,certain attachment always uploaded successfully,positive,positive
DOCE Office Managers,Some complaint types do not have clearly defined workflows.,complaint type clearly defined workflow,positive,negative
DOCE Office Managers,Complaint cases can take significant time to open.,complaint case take significant time open,negative,negative
DOCE Office Managers,System responsiveness slows when handling multiple activities simultaneously.,system responsiveness slows handling multiple activity simultaneously,neutral,neutral
DOCE Office Managers,Uploading documents can impact performance.,uploading document impact performance,neutral,neutral
DOCE Office Managers,Calls automatically disconnect after several minutes.,call automatically disconnect several minute,neutral,neutral
DOCE Office Managers,Long scheduling conversations are frequently interrupted.,long scheduling conversation frequently interrupted,negative,negative
DOCE Office Managers,Customers become frustrated when calls are dropped.,customer become frustrated call dropped,negative,negative
DOCE Office Managers,Staff lose significant time handling repeat calls.,staff lose significant time handling repeat call,negative,negative
DOCE Office Managers,Duplicate data entry is required across multiple applications.,duplicate data entry required across multiple application,neutral,neutral
DOCE Office Managers,Staff must frequently switch between systems to complete a task.,staff must frequently switch system complete task,neutral,neutral
DOCE Office Managers,Ownership information can be difficult to verify.,ownership information difficult verify,negative,negative
DOCE Office Managers,Address changes are not always reflected consistently.,address change always reflected consistently,neutral,neutral
DOCE Office Managers,Multiple property research tools must be used together.,multiple property research tool must used together,neutral,neutral
DOCE Office Managers,High call volumes create interruptions throughout the day.,high call volume create interruption throughout day,negative,negative
DOCE Office Managers,Front-counter traffic can become overwhelming.,traffic become overwhelming,neutral,neutral
DOCE Office Managers,"Staff rely heavily on personal notes, cheat sheets, and reference documents.",staff rely heavily personal note cheat sheet reference document,negative,negative
DOCE Office Managers,Knowledge of certain processes is dependent on individual staff experience.,knowledge certain process dependent individual staff experience,positive,positive
DOCE Office Managers,Limited standardization exists across some administrative workflows.,limited standardization exists across administrative workflow,negative,negative
DOCE Supervisors,Missed Case Tracking: Cases can be missed if tickle dates are not entered correctly.,missed case tracking case missed tickle date entered correctly,negative,negative
DOCE Supervisors,No Automatic Monitoring: No system-generated alerts for inactive or stalled cases.,automatic monitoring alert inactive stalled case,positive,negative
DOCE Supervisors,Open Case Cleanup: Large number of legacy and inactive cases require manual cleanup.,open case cleanup large number legacy inactive case require manual cleanup,positive,positive
DOCE Supervisors,"Cases Easily Lost: Cases, permits, and assignments can disappear from visibility if workflows are not followed correctly.",case easily lost case permit assignment disappear visibility workflow followed correctly,negative,negative
DOCE Supervisors,Human Error Dependency: The system relies heavily on users remembering to complete actions.,human error dependency system relies heavily user remembering complete action,negative,negative
DOCE Supervisors,Incomplete Historical Data: Historical information is missing or difficult to locate.,incomplete historical data historical information missing difficult locate,negative,negative
DOCE Supervisors,Difficult Property Research: Researching property history requires navigating multiple records and screens.,difficult property research researching property history requires navigating multiple record screen,negative,negative
