Focus Group,Pain Point,processed_pain_points,label,vader_sentiment
DOCE Supervisors,Parcel Search Challenges: Subdivided and inactive parcels are difficult to track.,parcel search challenge subdivided inactive parcel difficult track,negative,negative
DOCE Supervisors,Scattered Information: Related property information is not presented in a single view.,scattered information related property information presented single view,neutral,neutral
DOCE Supervisors,Limited Reporting Capability: Reporting and analysis require significant manual effort.,limited reporting capability reporting analysis require significant manual effort,neutral,neutral
DOCE Supervisors,"No Advanced Analytics: Limited ability to identify trends, recurring offenders, or enforcement patterns.",advanced analytics limited ability identify trend recurring offender enforcement pattern,neutral,negative
DOCE Supervisors,Volume Challenges: IPS becomes cumbersome as case volume increases.,volume challenge ip becomes cumbersome case volume increase,positive,positive
DOCE Supervisors,Specialized Knowledge Required: Users require significant experience to fully utilize the system.,specialized knowledge required user require significant experience fully utilize system,positive,positive
DOCE Supervisors,No Batch Processing: Large-scale updates and cleanup activities are difficult to perform.,batch processing update cleanup activity difficult perform,negative,negative
DOCE Supervisors,Duplicate Data Entry: Information must be entered and verified across multiple applications.,duplicate data entry information must entered verified across multiple application,neutral,neutral
DOCE Supervisors,No Single Source of Truth: Property information is distributed across multiple databases.,single source truth property information distributed across multiple database,positive,neutral
DOCE Supervisors,Missing Historical Records: Some historical records were lost or remain inaccessible.,missing historical record historical record lost remain inaccessible,negative,negative
DOCE Supervisors,"Paper-Based Archives: Information remains stored in microfiche, paper files, and legacy systems.",archive information remains stored microfiche paper file legacy system,neutral,neutral
DOCE Supervisors,Incomplete Digital Migration: Historical information has not been fully digitized.,incomplete digital migration historical information fully digitized,neutral,neutral
DOCE Supervisors,Email Overload: Excessive reliance on email for project management and collaboration.,email overload excessive reliance email project management collaboration,negative,negative
DOCE Supervisors,"Coordination Delays: Multiple departments are involved in many workflows, creating delays.",coordination delay multiple department involved many workflow creating delay,negative,positive
DOCE Supervisors,Camino Frustration: Contractors frequently struggle with Camino.,camino frustration contractor frequently struggle camino,negative,negative
DOCE Supervisors,"Address Discrepancies: Property addresses often differ between systems, creating confusion.",address discrepancy property address often differ system creating confusion,neutral,neutral
DOCE Supervisors,Constituent Escalations: Supervisors spend significant time responding to escalated complaints and requests.,constituent escalation supervisor spend significant time responding escalated complaint request,negative,negative
DOCE Zoning,"Fragmented Historical Records: Historical property, zoning, and parcel records are scattered across IPS, Camino, OnBase, AS400, microfiche, and paper archives, making research time-consuming.",fragmented historical record historical property zoning parcel record scattered across ip camino onbase microfiche paper archive making research,neutral,neutral
DOCE Zoning,"Complex Property Research: Parcel history is difficult to follow after subdivisions, lot alterations, ownership changes, and address changes.",complex property research parcel history difficult follow subdivision lot alteration ownership change address change,negative,negative
DOCE Zoning,"Incomplete Digital Records: Many historical zoning projects and approvals have not been migrated into IPS, requiring staff to search legacy systems.",incomplete digital record many historical zoning project approval migrated ip requiring staff search legacy system,positive,neutral
DOCE Zoning,"Limited Search Functionality: Searching historical parcels, addresses, and zoning records is inefficient due to limited filtering and search capabilities.",limited search functionality searching historical parcel address zoning record inefficient due limited filtering search capability,negative,negative
DOCE Zoning,"Scattered Project Information: Project documents, approvals, and historical records are distributed across multiple systems, making it difficult to view complete project history.",scattered project information project document approval historical record distributed across multiple system making difficult view complete project history,positive,negative
DOCE Zoning,Missing Supporting Documentation: Older zoning projects often contain incomplete attachments or missing supporting documents within IPS.,missing supporting documentation older zoning project often contain incomplete attachment missing supporting document within ip,positive,positive
DOCE Zoning,"Late Zoning Reviews: Certificate of Use and zoning reviews sometimes occur too late in the permitting process, delaying approvals.",late zoning review certificate use zoning review sometimes occur late permitting process delaying approval,positive,neutral
DOCE Zoning,Manual Research Process: Staff must switch between multiple systems and physical archives to complete property research.,manual research process staff must switch multiple system physical archive complete property research,neutral,neutral
DOCE Zoning,High Communication Volume: Responding to applicant inquiries and coordinating with reviewing departments consumes significant staff time.,high communication volume responding applicant inquiry coordinating reviewing department consumes significant staff time,positive,positive
DOCE Zoning,Cross-Department Dependencies: Zoning reviews depend on timely input and coordination from multiple City departments.,dependency zoning review depend timely input coordination multiple city department,neutral,neutral
DOCE Zoning,Legacy Record Dependency: Historical paper files and basement archives are still required to complete many zoning reviews.,legacy record dependency historical paper file basement archive still required complete many zoning review,neutral,neutral
LAW Law,"Incomplete Case Documentation: Legal work cannot proceed when notices, Nail & Mail documentation, photographs, or inspection records have not been uploaded into IPS.",incomplete case documentation legal work proceed notice nail mail documentation photograph inspection record uploaded ip,positive,positive
LAW Law,"Underutilized System: IPS is valuable when fully utilized, but inconsistent use by Code Enforcement results in incomplete notes and missing documentation.",underutilized system ip valuable fully utilized inconsistent use code enforcement result incomplete note missing documentation,positive,negative
LAW Law,Limited Property Overview: IPS cannot easily combine multiple complaints and violations into a comprehensive property-level view.,limited property overview ip easily combine multiple complaint violation comprehensive view,negative,negative
LAW Law,External Data Dependency: Water records require AS400 and tax information requires external systems because they are not integrated into IPS.,external data dependency water record require tax information requires external system integrated ip,neutral,neutral
LAW Law,Limited Document Export: IPS information cannot easily transfer into Microsoft Word for preparing legal documents.,limited document export ip information easily transfer microsoft word preparing legal document,positive,negative
LAW Law,Difficult Record Review: The Action Notes layout makes reviewing case history difficult because information is not presented clearly.,difficult record review action note layout make reviewing case history difficult information presented clearly,negative,negative
LAW Law,"Documentation Quality: Court cases are delayed when inspectors do not consistently upload documents, photographs, or complete notes.",documentation quality court case delayed inspector consistently upload document photograph complete note,negative,negative
LAW Law,"Manual Legal Research: Ownership, tax, and legal research require multiple external systems including Westlaw, County Clerk, eTax, and AS400.",manual legal research ownership tax legal research require multiple external system including westlaw county clerk etax,positive,positive
LAW Law,Cross-Department Dependencies: Legal work depends on inspectors completing investigations and providing complete documentation before cases can proceed.,dependency legal work depends inspector completing investigation providing complete documentation case proceed,positive,positive
LAW Law,Evidence Collection: Gathering exhibits and supporting documentation requires manual coordination across multiple departments and file repositories.,evidence collection gathering exhibit supporting documentation requires manual coordination across multiple department file repository,positive,positive
